{
  "schema_version": "1.0.0",
  "declaration_id": "synthetic.bank.connection",
  "declaration_version": "1.2.0",
  "created_at": "2026-07-31T00:00:00Z",
  "effective_from": "2026-07-31T00:00:00Z",
  "expires_at": "2027-07-27T00:00:00Z",
  "core_anchor": {
    "file_name": "NC25_v3_0_patched_v4.tex",
    "core_version": "3.0",
    "doi": "10.17605/OSF.IO/NHTC5",
    "sha256": "20F1EA17E0B986627CAD9AFA7C02E1DC5088C43A779435E5A38F11E43A06C9C3"
  },
  "profile_binding": {
    "profile_id": "banking.reference.v1",
    "profile_version": "1.3.0",
    "profile_hash": "925EF12281DB3777A5A11585B8DE8AF7224B10154CF525640C8B31BFCD3532FA"
  },
  "connector": {
    "connector_id": "synthetic-bank-connector"
  },
  "instance_scope": {
    "action_ids": [
      "BANK_PAYMENT_POST",
      "BANK_PAYMENT_STATUS_READ",
      "NO_EFFECT_FALLBACK"
    ],
    "effect_class_ids": [
      "BANK_LEDGER_MUTATION",
      "BANK_READ_ONLY_QUERY",
      "NO_EFFECT"
    ],
    "target_system_ids": [
      "bank-sandbox-ledger",
      "bank-sandbox-query",
      "local-fallback"
    ],
    "action_target_bindings": {
      "BANK_PAYMENT_POST": [
        "bank-sandbox-ledger"
      ],
      "BANK_PAYMENT_STATUS_READ": [
        "bank-sandbox-query"
      ],
      "NO_EFFECT_FALLBACK": [
        "local-fallback"
      ]
    },
    "scope_constraints": {
      "product": [
        "synthetic-payment"
      ],
      "customer_segment": [
        "synthetic-corporate"
      ],
      "region": [
        "GB"
      ],
      "currency": [
        "GBP"
      ]
    }
  },
  "structural_budget": {
    "capacity": 10000
  },
  "resource_limits": [
    {
      "resource_id": "money_minor_units",
      "max_per_intent": 50000,
      "max_committed_per_window": 250000,
      "window_seconds": 86400
    },
    {
      "resource_id": "query_units",
      "max_per_intent": 1,
      "max_committed_per_window": 10000,
      "window_seconds": 86400
    }
  ],
  "governance": {
    "approval_owner_id": "synthetic-approval-owner",
    "authority_issuer_id": "synthetic-authority-issuer",
    "revision_authority_ids": [
      "synthetic-revision-board"
    ],
    "no_live_gate_override": true
  },
  "interfaces": {
    "off_limits_system_ids": [
      "production-core-ledger",
      "architect-private-store"
    ]
  },
  "mapping_witness_binding": {
    "witness_id": "bank-questionnaire-crosswalk-v1",
    "witness_hash": "6E9712AFA89C2014F1557B28988891209E30F5C05F3F1881519D0F19AB5673EE"
  }
}
